{
  "chart_id": "legacy_kpi_days_outstanding",
  "client": "almacena",
  "title": "Avg Days Outstanding",
  "chart_type": "kpi_card",
  "source": "custom",
  "entity": "ap_foundation",
  "value_format": "days",
  "period": {"kind": "current_month"},
  "data": [
    {"label": "Days Outstanding",
     "query": {"kind": "kpi_value", "kpi": "Average Days Outstanding"}}
  ]
}
