{
  "chart_id": "legacy_portfolio_health",
  "client": "almacena",
  "title": "Portfolio Health: % GMV Insured",
  "chart_type": "line",
  "source": "custom",
  "entity": "ap_foundation",
  "value_format": "percent_decimal",
  "period": {"kind": "ltm", "months": 12},
  "axes": {"y": {"format": "percent_decimal"}},
  "data": [
    {"label": "% GMV Insured",
     "query": {"kind": "kpi_trend", "kpi": "% GMV Insured"}}
  ],
  "notes": "Legacy createPortfolioHealthChart shipped with one series only (% GMV Insured) despite the spec describing three. Mirroring the implementation, not the spec."
}
