{
  "chart_id": "legacy_kpi_funded",
  "client": "almacena",
  "title": "Total Funded",
  "chart_type": "kpi_card",
  "source": "custom",
  "entity": "ap_foundation",
  "value_format": "eur",
  "period": {"kind": "current_month"},
  "data": [
    {"label": "Funded Amount", "query": {"kind": "kpi_value", "kpi": "Funded Amount"}}
  ]
}
