{
  "chart_id": "legacy_gmv_funded_trend",
  "client": "almacena",
  "title": "GMV vs Funded Amount Trend",
  "chart_type": "line",
  "source": "custom",
  "entity": "ap_foundation",
  "value_format": "eur",
  "period": {"kind": "ltm", "months": 12},
  "axes": {"y": {"format": "EUR_thousands"}},
  "data": [
    {"label": "GMV", "query": {"kind": "kpi_trend", "kpi": "GMV"}},
    {"label": "Funded Amount", "query": {"kind": "kpi_trend", "kpi": "Funded Amount"}}
  ],
  "notes": "Legacy charts.js: dual-series area line, deep teal + mid teal."
}
