{
  "chart_id": "legacy_kpi_gmv",
  "client": "almacena",
  "title": "Total GMV",
  "chart_type": "kpi_card",
  "source": "custom",
  "entity": "ap_foundation",
  "value_format": "eur",
  "period": {"kind": "current_month"},
  "data": [
    {"label": "GMV", "query": {"kind": "kpi_value", "kpi": "GMV"}}
  ]
}
