{
  "chart_id": "legacy_kpi_invoices",
  "client": "almacena",
  "title": "Total Invoices",
  "chart_type": "kpi_card",
  "source": "custom",
  "entity": "ap_foundation",
  "value_format": "count",
  "period": {"kind": "current_month"},
  "data": [
    {"label": "# Invoices", "query": {"kind": "kpi_value", "kpi": "# Invoices"}}
  ]
}
