{
  "chart_id": "legacy_operational_efficiency",
  "client": "almacena",
  "title": "Operational Volume",
  "chart_type": "clustered_bar",
  "source": "custom",
  "entity": "ap_foundation",
  "value_format": "count",
  "period": {"kind": "ltm", "months": 12},
  "axes": {"y": {"format": "count"}},
  "data": [
    {"label": "# Invoices", "query": {"kind": "kpi_trend", "kpi": "# Invoices"}},
    {"label": "# Boxes",    "query": {"kind": "kpi_trend", "kpi": "# Boxes"}}
  ],
  "notes": "Legacy createOperationalChart: side-by-side bars per month. Legacy also overlaid a 'boxes per invoice' line — needs multi-KPI ratio support, skipped here."
}
